Number,Title,Author,banHao,Date,Download,Links,Contents,Keywords,Editorial
447,执行好“动态清零”，早日“回归正常”,曹静;,2,5/2/22,50,https://kns.cnki.net/kcms2/article/abstract?v=XvFfKg0MvvXihLYjwN_3wVMvR0GSKMK0sPvQdL2fWchCkkIRG1OAR9CC35wHX92030xPp6hFmx1I7TP8ufyT0QozzSI0PjzApDGGNEAad5D1hHdrwMhwiQeGpcbZve_q&uniplatform=NZKPT,"记者：面对新冠疫情，我们国家选择了“动态清零”的总方针。两年多来，您有何感受？
毛时安：2020年新冠疫情暴发后，在党中央强有力的领导下，全国医务工作者、全国人民精诚团结，守望相助，同舟共济，在抗击新冠疫情的战役中取得了令人信服的胜利。这两年多的实践充分说明了，我们的“动态清零”的方针是正确的，是坚持“人民至上、生命至上”的最佳选择。
这两年多的实践也充分体现了我们集全国之力渡难关、办大事的制度优势。政府有整合各方资源、动态清零的能力，而人民也能竭尽全力克服困难，自觉积极配合动态清零。因此，我们能最大限度地缩小疫情影响范围，最大限度地减少感染、重症和死亡，体现了最高的人道主义，这一点毋庸置疑。因此，我们要继续坚持“动态清零”总方针，不犹豫不动摇。
记者：具体该怎么理解“动态清零”？
毛时安：个人之见，看待“动态清零”有两个层次。第一，清零是战略目标，是基本理念，要坚守，不犹豫不动摇。第二，动态是手段是方法，是战术。在具体措施和做法层面，必须不断进行调整，科学、准确、全面地去理解、落实动态清零的总方针。
在实行动态清零的过程中，我也在反复思考：动态清零，第一，清什么？第二，怎么清？我理解，“清什么”是有层次的。第一层次，是新冠死亡率，第二层次，是重症率，第三层次是阳性感染率，也是我们“应收尽收”的对象。所以，我们要把医疗救治工作摆在突出位置，按照第九版诊疗方案，实事求是地对患者进行分类，坚持分类收治，防止轻症转重症、危重症，集中优势兵力，全力以赴救治重症患者，千方百计降低病死率。同时，严格居家隔离等措施，要以快制快，切实阻击疫情传播，才能守护好人民群众的生命安全和身体健康。
假如把城市比喻成人体的话，这次疫情大考考验的不仅是城市整体运行健康状况、各个器官的机能，而是深入到了末梢神经、毛细血管，抵达每一个细小的血液微循环。我们要高度关注城市抗疫微循环的畅通无阻。其中，有几类弱势群体需要我们特别关注，比如，高龄老人、高危病人、儿童、孕产妇等；城市中的特殊群体，比如风险较高的快递人员、居无定所的外地务工者、长期封闭在高校内的大学生等等，要为他们解燃眉之急，妥善安置，并进一步关心他们的身心健康。此外，还有柴米油盐日常生活物资的保供流通，等等。
记者：当前，还可以加强哪些方面的工作？
毛时安：这一波紧张抗疫，引起了不少民众的心理震荡。因此，还要全面普及关于病毒的科学知识，让市民对病毒的危害性有正确的认识。强调防疫要个人卫生“三件套”“五还要”，既要重视，也不要恐慌。一旦对病毒的恐慌超过了病毒的实际危害，反而会造成更严重的次生灾害。一方面，我们要科学、准确、全面地理解落实好“动态清零”的总方针，毫不动摇；另一方面，要“针对病毒变异的新特点，提高科学精准防控本领”，不断调整具体做法，变严防死守为严防巧守，使得动态清零的实现举措和方法本身动态化。
文学是人学，医学是仁学。在“人民至上、生命至上”这一最高价值追求和重要思想的指导之下，在抗疫的每一个环节坚持人文关怀、人道主义，保障好就医需求，做好“米袋子”“菜篮子”等生活必需品供应，努力用最小的代价实现最大的防控效果，最大限度减少疫情对经济社会发展的影响。
最近这一阶段，我也看到、听到了身边的许多动人的故事。在这些艰难而平常的日子里，2500万上海人，以忍耐、坚守和相互的理解配合，书写着人性的高贵。我们相信，在党和政府坚强有力的领导下，团结一心，上海一定会“回归正常”。
",总方针; 毛时安; 人民至上;,
448,上海六个区实现社会面基本清零,顾泳;,2,5/2/22,1,https://kns.cnki.net/kcms2/article/abstract?v=XvFfKg0MvvXihLYjwN_3wVMvR0GSKMK0sPvQdL2fWchCkkIRG1OAR9CC35wHX9206Tfo1u4K92nYA79jAXoTFKuTY-pPY_A9wzVqLkGOavsPLVaBpdWoFfb_L3y47McJ&uniplatform=NZKPT,"以行政区为单位，区内社会面（含管控区、防范区，以及非闭环管理的社会流动人员等）阳性感染者数量日趋减少、风险可控；如连续三天单日新增数占区内总人口数比例小于十万分之一，可认为社会面基本清零。如连续三天单日新增数为零，就实现了社会面清零。本轮疫情社会面清零之后，全市将进入常态化防控阶段
闭环管控发现的阳性感染者包括：集中隔离筛查、居家隔离筛查、封控区筛查、确认可以做到封闭管理的重点场所筛查、密接筛查等方式发现的阳性感染者。相关风险人群筛查发现的阳性感染者包括：管控区筛查、社区（防范区）筛查、主动就诊/因症就诊、主动核酸检测、重点人群筛查、外省协查等方式发现的阳性感染者
昨天举行的上海市新冠肺炎疫情防控新闻发布会上，上海市政府副秘书长、市疫情防控领导小组办公室主任顾洪辉表示，近一个月以来，在全国各地的齐心援助和全体市民的共同努力下，上海本轮疫情防控取得阶段性成效。当前，上海已有6个区实现社会面基本清零。
分区分级差异管控
顾洪辉介绍了社会面清零和基本清零的评价标准。即以行政区为单位，区内社会面（含管控区、防范区，以及非闭环管理的社会流动人员等）阳性感染者数量日趋减少、风险可控；如连续三天单日新增数占区内总人口数比例小于十万分之一，可认为社会面基本清零。如连续三天单日新增数为零，就实现了社会面清零。本轮疫情社会面清零之后，全市将进入常态化防控阶段。
对照上述标准，奉贤、金山、崇明、青浦、松江、普陀六区符合社会面基本清零标准。这六区在做好“三区”管控的同时，实施“有限人员、有限区域、有限活动”，通过全面推进十大攻坚行动，力争早日实现社会面清零的目标。黄浦、静安、徐汇、长宁、虹口、杨浦、宝山、闵行和嘉定等9个区，继续从严从紧，实施“全域严格管理、全员检测筛查、全面流调排查、全民清洁消杀，全程查漏补缺”等综合防控措施，力争尽早实现社会面基本清零。浦东新区将按照街镇划分，并实施相应的分区分级差异化防控措施。目前，浦东新区宣桥、泥城、大团、万祥、老港等5个镇，已符合社会面基本清零的标准。
按照“三区”划分要求，实施从严管控，最大限度减少人员流动聚集。对封控区，严格实施“足不出户、服务上门”的管控要求，防止人员外出流动；对管控区，严格实施“人不出小区（单位），错峰取物”的管控要求，原则上居家，每户每天可在严格做好个人防护的前提下，分时有序、分区限流至小区指定区域活动，无接触式收取快递物资。对防范区，严格实施“个人防护，严禁聚集”的防控要求，按照“有序放开、有限流动、有效管控、分类管理”的原则，实行分区分级差异化管控。
分区分级组合检测
发布会公布数据显示，4月30日上海新增788例新冠肺炎本土确诊病例和7084例本土无症状感染者。788例本土确诊病例中，105例在闭环隔离管控中发现，683例为无症状感染者转归确诊病例。7084例本土无症状感染者均在闭环隔离管控中发现。截至30日24时，在定点医疗机构接受治疗的重型患者342例、危重型61例。30日全市本土确诊病例出院3055例，无症状感染者解除集中隔离医学观察16021例。
顾洪辉介绍，本土阳性感染者自4月13日达到单日峰值27605例后，总体呈现波动下降趋势。4月27日起，单日新增感染者数量已连续4天在1万例以下；本轮疫情的有效传播指数（实时再生数）Rt值，由此前的2.27下降到现在的0.67，已连续15天维持在1以下；核酸筛查和抗原检测的阳性检出率逐步下降。经专家综合研判，本市疫情社区传播风险已得到有效遏制。
当前全市疫情稳中向好，清零攻坚效果日益显现，但新增感染者仍处高位，疫情防控还不稳固，稍有松懈就可能反弹。因此上海将在5月1日至7日继续开展核酸筛查工作，采取分区分级的“核酸+抗原”组合检测模式。对于封控区，每天进行一次核酸采样；管控区采用“3次核酸+4次抗原”组合筛查方式；防范区采用“1次核酸+6次抗原”组合筛查方式。此外，对前期没有按照要求参加核酸筛查的人员“随申码”赋黄码。
上海市卫生健康委主任邬惊雷就市民关心的问题加以解释，闭环管控发现的阳性感染者包括：集中隔离筛查、居家隔离筛查、封控区筛查、确认可以做到封闭管理的重点场所筛查、密接筛查等方式发现的阳性感染者。相关风险人群筛查发现的阳性感染者包括：管控区筛查、社区（防范区）筛查、主动就诊/因症就诊、主动核酸检测、重点人群筛查、外省协查等方式发现的阳性感染者。5月1日起，全市将按照上述规则对每日疫情发布阳性感染者发现方式进行分类。后续根据本市疫情发展和防控策略要求，新冠病毒阳性感染者的发现方式将视情动态调整。
",无症状; 人群筛查; 疫情防控; 感染者; 上海市; 确诊病例;,
449,“侬好上海”为上海商家精准纾困,查睿;,2,5/1/22,1,https://kns.cnki.net/kcms2/article/abstract?v=XvFfKg0MvvXihLYjwN_3wVMvR0GSKMK0sPvQdL2fWchCkkIRG1OAR9CC35wHX920hSVYsgnoNvrbqbZTPwWUPkfZSUYtbAEAbP2d6jikRnyW6UfycaP2AwHM98DwnCG8&uniplatform=NZKPT,"本报讯（记者 查睿）4月29日，淘宝发布“侬好上海”20条，向上海商家提供一系列精准纾困措施，帮助商家缓解现金流压力、降低经营成本，尽可能加快复工复产速度。
据悉，4月8日—5月6日，上海地区的淘宝、天猫商家，可凭借物流订单信息免费享受“提前收款”服务，从而快速回笼资金；暂时无法还款的商家，可拿到延期还款券，免息延长一次还款期。5月1日—6月30日，上海地区的1688诚信通会员商家将享受网商贷30天免息贷款服务。
同时，在经营成本上做“减法”。阿里妈妈提供价值3400万元营销补贴红包，商家可直接抵扣营销推广费；同时，阿里妈妈还开辟了为期两个月的营销复苏专属流量池，每个月提供十亿流量。淘宝天天特卖将针对上海工厂型商家推出“产地节”活动。5月1日—6月30日，1688商家可在“商贸企业专区”和“工厂企业专区”获得免费推广资源。
聚划算将为上海商家提供价值2000万元的营销资源扶持，同时发起为期10天的上海购物消费节，帮助消费复苏。此外，商家可通过聚划算设立的24小时响应的“上海商家专项帮扶中心”，享受“一企一策”的定点帮扶。
为了最大限度缓解商家经营压力，淘宝天猫还为上海商家专门做了平台规则的适时调整。因疫情导致延迟发货而引发消费者投诉，商家可免责；商家退换货的处理时效延迟到21天；淘宝还提供区域限售工具，商家可根据区域销售情况和物流预期灵活调整发货周期；商家的揽收及时率、到货时长、物流顾客满意度、商家退款退货处理时长等指标，均暂不纳入平台经营考核范围。
除上述举措外，为了畅通供应链、打通堵点卡点，淘宝天猫联动菜鸟，优先解决上海商家的物流问题。菜鸟紧急开通“南京—上海”和“嘉兴—上海”两条应急运输干线。针对货源不在上海的商家，菜鸟提供分仓转仓服务，保障订单履约。菜鸟协同中国邮政、四通一达、顺丰等快递公司，对商家单量进行分层处理，提高商家发货效率。此外，菜鸟还将采取包机、包船等非常规手段加大加快物流运转速度。
",阿里妈妈;,
450,疫情下为上海持续注入“芯”动能,李晔;,1,5/1/22,1,https://kns.cnki.net/kcms2/article/abstract?v=XvFfKg0MvvXihLYjwN_3wVMvR0GSKMK0sPvQdL2fWchCkkIRG1OAR9CC35wHX920Dv6XLvjSVQwzTPOw-EMsC3rImgHkxfPr1-2My7_WU-_XNXegTa0ivAUyGmoDoTFv&uniplatform=NZKPT,"4月28日，当上海华虹宏力半导体制造有限公司荣膺中华全国总工会授予的“全国五一劳动奖状”的喜报传来，已在公司连续奋战超过31天的驻厂员工们仿佛被注入“芯”动能。上海此轮疫情发生以来，面对隔离管控举措和全域静态管理要求，华虹宏力员工或主动留守，或逆行赶回工厂，以厂为家，闭环运行，开启驻守工厂的“芯”生活，锚定的就是一个目标——保障芯片“不停产、不断供”。
1996年，华虹宏力从建设我国内地第一条8英寸集成电路生产线起步，现已成为全球领先的特色工艺纯晶圆代工企业。华虹宏力专注于嵌入式非易失性存储器、功率器件、模拟及电源管理和逻辑及射频等“8英寸+12英寸”特色工艺技术的持续创新，拥有多年成功量产汽车芯片的经验。目前，公司拥有上海、无锡两地四厂，即在上海金桥和张江建有3座8英寸晶圆厂，同时在无锡拥有12英寸晶圆厂，公司工艺技术覆盖了1微米至65/55纳米各节点，在北美、欧洲、日本、中国台湾等地均提供销售与技术支持。芯片是“工业的粮食”，当下，全球芯片供应链尤其吃紧，华虹宏力又承担着芯片制造关键一环，因此必须保障连续性生产，才能确保下游客户的各类产品都有芯片可用，有效缓解电子终端产品市场的“缺芯”难题。
即便是严峻疫情，也未能掐灭“芯”火。今年3月初开始，华虹宏力未雨绸缪，提前启动疫情防控应急预案，成立消杀卫生保障、核酸抗原检测、生活保障、物资分配等多个专班。华虹集团党委书记、董事长张素心要求，各类原料库存一旦低于40小时可用，就必须协调调度，千方百计保证生产线不停。华虹宏力的供应链部门每天核对原料库存“安全水位”，积极解决市内调拨、跨省运输等各类问题，此轮疫情迄今，已协调完成28辆大宗化学品槽车的运输，运送专用药液3050桶。面对无情疫情，华虹宏力展现出惊人向心力和凝聚力，沪锡两地四个工厂始终保持7×24小时不间断满负荷高效运行，3月产量甚至创下历史新高。
疫情阻挡不了华虹宏力创新与奋斗的脚步。据透露，华虹无锡12英寸生产线的产能，年底有望扩充至每月9万片，同时，公司将继续做大做强“8英寸+12英寸”生产线，把这一金字招牌擦得更亮。
",原料库存;,
451,快递业有序推进复工复产,张杨;,2,5/1/22,1,https://kns.cnki.net/kcms2/article/abstract?v=XvFfKg0MvvXihLYjwN_3wVMvR0GSKMK0sPvQdL2fWchCkkIRG1OAR9CC35wHX920vpRjJdZPempsUscXUIcCiA4v91X5EZ9H8x-T_St0C-ITUSysGvPLFXAzeIfkqYgu&uniplatform=NZKPT,"本报讯（记者 张杨）上海快递业迎来好消息。近日，上海市邮政快递业按照国家邮政局和市委市政府关于统筹推进疫情防控和复工复产工作的有关要求，精心组织，周密准备，积极稳妥逐渐有序推进复工复产工作。
上海市邮政管理局结合上海和行业实际，分保供、保通、保畅三个阶段积极稳妥逐渐有序开展复工复产工作。根据安排，当前行业的主要任务是开展受各级政府、部门委托的保供工作，承担防疫物资、紧急药品和人民群众生活必需品的运递服务，以及已复工复产企业的点对点服务，不开放网点营业。待社会面动态清零后，将视疫情防控形势，合理开放部分分拨处理中心和营业网点，以生产生活资料和关系国计民生的产业链供应链为服务保障重点，满足部分寄递需求。直至社会经济秩序逐步全面恢复，行业将全面开放分拨处理中心和营业网点的运营，全面恢复寄递业务。
",快递业; 疫情防控;,
452,振奋精气神 责任再压实 打好主动仗,孟群舒;,1,5/1/22,2,https://kns.cnki.net/kcms2/article/abstract?v=XvFfKg0MvvXihLYjwN_3wVMvR0GSKMK0sPvQdL2fWchCkkIRG1OAR9CC35wHX920M72rHQDMFxsK-CphUSL7Y-tGEl2TPdV1rN76GAb-BM4vBO-SbMj1fWCykOBJZa3k&uniplatform=NZKPT,"要下定决心，加快启动建设一批集中隔离点，宁可备而不用，让房间供给有效满足隔离需求。要刻不容缓推进建设，抢出时间进度，尽早投入使用
本报讯（记者 孟群舒）中共中央政治局委员、国务院副总理孙春兰4月29日至30日在上海调研指导疫情防控工作，强调要深入贯彻习近平总书记重要指示精神，按照党中央、国务院决策部署，坚定不移执行“动态清零”总方针，进一步振奋攻坚克难、决战决胜的精气神，责任再压实，打好主动仗，一气呵成，尽快打赢这场疫情防控攻坚战。
市委书记李强，市委副书记、市长龚正参加相关活动。
为更好满足密接人员集中隔离需要，上海正加快建设集中隔离点。30日上午，孙春兰来到江湾体育场，实地察看杨浦区新建的1000间集装箱板房，听取施工建设及投用管理情况汇报。在国家会展中心（上海），孙春兰深入了解场馆周边停车场建设集中隔离点的规划设计方案，就优化空间设计、加快建设速度等与相关负责同志作了交流。孙春兰指出，及时转运隔离密接人员，是切断社区传播链的重要一环，动作越快，转运越及时彻底，成本越低，拖尾时间越短。要下定决心，加快启动建设一批集中隔离点，宁可备而不用，让房间供给有效满足隔离需求。要刻不容缓推进建设，抢出时间进度，尽早投入使用，保障隔离房间基本功能，最大化利用空间。要从严加强工地管理，严格落实防控措施，确保防疫安全、生产安全。30日下午，孙春兰来到市疫情防控指挥部，听取全市疫情防控情况汇报，与相关区进行视频连线调度，提出明确工作要求。
孙春兰指出，要根据奥密克戎变异毒株带来的新情况新挑战，持续完善应对举措，加强疫情防控的扁平化指挥调度，做好设施、物资、队伍等各方面准备，提高基层防控政策的执行能力，确保各项防控工作落实到位。要继续开展拔点攻坚，聚焦重点，挂图作战，坚持以快制快、兵贵神速，密接人员要坚决集中隔离，确保“四应四尽”、日清日结，在最短时间内阻断社区传染。要从严从紧加强管理，压实“四方责任”，针对疫情防控、社区管理中存在的不足和问题，从严加强流动人员管理，重点区域和重点单位要开展自查，开展隔离点管理提升行动，补齐短板漏洞，完善管理机制，细化操作措施，严防“跑冒滴漏”。要深入细致做好群众工作，全力抓好民生保障，持续做好主副食品、生活必需品的供应配送，帮助群众排忧解难，更好凝心聚力、形成合力。
",孙春兰; 精气神; 疫情防控;,
453,拧紧责任链条不断巩固扩大防控成果,NA;,1,5/1/22,4,https://kns.cnki.net/kcms2/article/abstract?v=XvFfKg0MvvXuZMsqyFPOfBvuYsLKxrOQDpvmV-dD5UDX-40cTY_EU5X-F2uLD8Ycgil4VEC7nXv8Tnac8-DTdFgsoRXVEIb915tor-IqwOhxuPwbsrf5PZSd8VxvhKbu&uniplatform=NZKPT,"突出抓好拔点攻坚，集中力量打好攻坚战、歼灭战
加快提升核酸采样点的覆盖面和便民度。实现即到即采、即采即送、即送即检
切实加强对快递骑手等流动人员的防疫管理和核酸检测，开展专项整治行动
本报讯 市委书记、市疫情防控工作领导小组组长李强昨天下午在市疫情防控指挥部主持召开工作会议，研究部署下一阶段全市疫情防控重点工作，与相关区进行视频连线调度，推动落实国务院联防联控机制有关工作要求。当晚主持召开市疫情防控工作例会，分析研判疫情形势，压紧压实疫情防控重点任务。李强指出，要深入学习贯彻习近平总书记重要指示精神，坚持“动态清零”总方针不动摇，进一步强化使命担当，拧紧责任链条，从严从紧、持续推进攻坚行动，严格落实“三区”管控，坚持清零一块、守住一块，连点成片、连片成面，不断巩固扩大疫情防控成果。
市委副书记、市长、市疫情防控工作领导小组组长龚正，市人大常委会主任蒋卓庆，市政协主席董云虎，市委副书记诸葛宇杰出席相关活动。
会议指出，要突出抓好拔点攻坚，集中力量打好攻坚战、歼灭战。对老旧小区、城中村、建筑工地、大型企业和养老院等要“一点一策”，实行领导干部包保，挂图作战、全力攻坚、清账销项。加强各区之间资源统筹，全力确保应转尽转、应隔尽隔。认真开展专项流调排查，进一步拧紧“水龙头”，严防出现反弹外溢，彻底切断传播链。持续用力抓好社会面管控，不断调整优化“三区”管理措施。扎实推进无疫小区创建，做到资源保障到位、社会动员到位、日常管理到位。强化对基层环境清洁消杀工作的支撑。派驻各区的督导组、工作组要更好发挥作用，帮助发现问题、解决问题。
会议指出，要加快提升核酸采样点的覆盖面和便民度，坚持场景导向、便捷高效，持续优化服务功能。新建的核酸检测能力要下沉式、分布式布局，与采样点精准匹配，实现即到即采、即采即送、即送即检的无缝衔接。切实加强对快递骑手等流动人员的防疫管理和核酸检测，开展专项整治行动，加大路面抽查力度，压实平台企业责任，对漏检瞒报以及无证快递骑手要依法依规严肃处理并曝光警示。高度重视援企稳岗工作，用好领导干部联系企业制度，认真排摸并及时帮助企业解决实际困难。加快打通复工复产堵点，在畅通物流、员工返岗以及流程审核等方面加强统筹协调，主动跨前作为，为有序推进复工复产创造良好条件。
",疫情防控; 核酸检测; 攻坚战;,
