Number,Title,Author,banHao,Date,Download,Links,Contents,Keywords,Editorial
363,分三阶段恢复正常生产生活秩序,黄杨子;,2,5/17/22,1,https://kns.cnki.net/kcms2/article/abstract?v=XvFfKg0MvvX1b2fDUaIYIN3oyrsdP4w83vZX_4zDw-CLMBENOQ6S8b2zW4MOQB4qnhSxCcfu1iIUJVk3eNsl8Upfaukyi5LOatOGvq_paJfgCLRoO9ucuKWOADvQcAhs&uniplatform=NZKPT,"第一阶段 巩固清零攻坚“十大行动”成果阶段。从现在开始至5月21日，重点是降新增、防反弹，持续减少封控区、管控区人数，防范区有序放开、有限流动、有效管控，全市保持低水平社会活动
第二阶段 向常态化防控转换阶段。5月22日至5月31日，单日新增感染者数进一步减少，不断缩小封控区和管控区范围直至解封，加快疫情防控向常态化分级分类管理转变
第三阶段 全面恢复全市正常生产生活秩序阶段。6月1日至6月中下旬，在严格防范疫情反弹、风险可控的前提下，全面实施疫情防控常态化管理，全面恢复全市正常生产生活秩序
本报讯（记者 黄杨子）在昨天举行的市疫情防控工作新闻发布会上，上海市副市长宗明通报了近期防控工作情况。
本轮疫情发生以来，上海毫不动摇坚持“动态清零”总方针，全力遏制疫情扩散蔓延，确保人民群众生命安全和身体健康。经过全市上下共同努力，目前全市16个区已有15个区实现社会面清零，封控区总人数降至100万人以内，15日新增阳性感染者数首次降至1000例以内，全市社会面已连续两天无新增阳性感染者报告，上海疫情得到有效控制，防控取得阶段性成效。同时，我们也清醒看到，一些集中隔离点和封控区的老旧小区等还有阳性感染者报告。疫情反弹风险依然存在，全市防控基础还不够稳固，需要我们继续不断努力，也需要广大市民朋友继续给予支持和配合，只有进一步持续巩固疫情防控成果，才能有序恢复正常生产和生活秩序。
随着各项防控措施的落地实施，综合专家研判分析，本市明确了下一步防控工作，分为“三个阶段”。第一阶段：巩固清零攻坚“十大行动”成果阶段。从现在开始至5月21日，重点是降新增、防反弹，持续减少封控区、管控区人数，防范区有序放开、有限流动、有效管控，全市保持低水平社会活动。第二阶段：向常态化防控转换阶段。5月22日至5月31日，单日新增感染者数进一步减少，不断缩小封控区和管控区范围直至解封，加快疫情防控向常态化分级分类管理转变。第三阶段：全面恢复全市正常生产生活秩序阶段。6月1日至6月中下旬，在严格防范疫情反弹、风险可控的前提下，全面实施疫情防控常态化管理，全面恢复全市正常生产生活秩序。
关于社会面管控，推动“三区”管控逐步向常态化分级分类管理过渡，封控区“区域封闭、足不出户、服务上门”，若封控区7天无新增阳性感染者降为管控区，管控区“人不出小区、严禁聚集”，若此后管控区再连续3天无新增阳性感染者降为防范区；防范区“强化社会面管控、严格限制人员聚集”。
关于监测预警，通过场所码、数字哨兵、核酸检测、抗原自测、医疗机构症状发现、药店监测等，进一步构建多点触发监测预警机制。出入有明确防疫要求的公共场所、搭乘公共交通工具的人员，须持48小时内核酸检测阴性证明。在社区、园区、商场、超市、学校、交通场站等场所布局常态化核酸检测采样点，构建15分钟核酸采样服务圈。
关于交通组织，市域交通，5月16日起，巡游出租车、私家车可在社会面清零的金山、奉贤等非中心城区和浦东新区相关镇域范围通行，在徐汇、黄浦等中心城区以及拓展区的闵行、宝山区和浦东新区相关街道范围暂凭机动车电子通行证通行，继续提供就医等应急需要预约用车。5月22日起，地面公交和轨道交通有条件逐步恢复运营。网约车参照社会车辆通行管理要求。对外交通，5月16日起，铁路逐步增加上海虹桥站、上海站等的到发列车数量，逐步恢复正常运行。后续，航空逐步恢复国内航班执飞本市，适时调整国内外航司执飞本市航班的客座率。
关于公共服务，严格落实公共服务场所各项防控措施，实施限流有序开放，定期开展区域消杀，做好人员健康管理，把好疫情防控“出入关”。进一步加强城市运行服务保障，相应公共服务人员逐步到岗到位。做好水、电、燃气、通信等的线路设备保养工作，以及公共道路、绿地等公共场所清洁保养。
本市将分阶段推进复工复产。5月16日起，先集中恢复产业链供应链，然后再逐步扩大复工复产范围。非生产性企业，继续倡导居家办公。
分阶段复商复市。5月16日起，先有序恢复超市卖场、便利店、药店等线下业务，再有序恢复农贸市场、理发和洗染服务等。各类影剧院、文博场所、健身房等密闭活动场所暂缓开放。
分阶段复学复课。优先安排有高考和中考任务的高三、高二、初三年级学生复学。中小学其他各年级继续开展线上教学。幼儿园、托儿所、托育机构等不安排幼儿返园。做好高校有离校返乡意愿学生的服务工作以及自愿留校学生的疫情防控、学习生活保障等工作。
5月15日，本市新增69例新冠肺炎本土确诊病例和869例本土无症状感染者。69例本土确诊病例中，27例在闭环隔离管控中发现，42例为无症状感染者转归确诊病例。869例本土无症状感染者均在闭环隔离管控中发现。截至5月15日24时，在定点医疗机构接受治疗的重型患者261例、危重型65例。新增本土死亡病例4例。
",疫情防控; 常态化管理; 正常生产; 确诊病例; 感染者; 核酸检测; 公共场所; 防控措施; 分级分类;,
364,增强各类主体和投资者消费者信心,孟群舒;,1,5/17/22,2,https://kns.cnki.net/kcms2/article/abstract?v=XvFfKg0MvvX1b2fDUaIYIN3oyrsdP4w83vZX_4zDw-CLMBENOQ6S8b2zW4MOQB4qnBktR2DKcXJTm7aN0cJZhGxYJgnsBeHrUlNFcUjlOJxCEBLRV2wcqerFP8VtE1vw&uniplatform=NZKPT,"本报讯（记者 孟群舒）市委副书记、市长龚正昨天主持召开市政府常务会议，强调按照市委部署，坚决筑牢疫情防控屏障，统筹抓好疫情防控和经济社会发展，加快推进复工复产和经济恢复；扎实做好防汛防台工作，守牢城市安全底线。
会议指出，在毫不放松抓紧抓实疫情防控的基础上，要尽早出台实施一批针对性强、含金量高、覆盖面广的政策措施。要统筹好常态化疫情防控和经济恢复重振，进一步巩固防控成果，筑牢发展前提和基础。统筹好有为政府和有效市场，在财政政策主动积极的基础上，更加重视释放市场主体活力和积极性，增强各类主体和投资者、消费者的信心。统筹好普惠性鼓励支持和重点领域精准发力，紧密结合中长期战略规划，切实发挥好政策对推动产业结构转型升级的引导作用。纾困措施要立竿见影、落地见效，把保市场主体尤其是中小企业放在突出位置，聚焦堵点瓶颈，坚持问题导向，激发企业自身潜能。要突出重点、提振动能，重中之重是稳住“三大需求”。促投资方面，各级各类在建项目要“应复尽复”，全力保障重大外资项目顺利推进。稳外贸方面，切实落实支持性政策，多措并举帮助外贸企业纾困。扩消费方面，释放受疫情抑制的消费潜力。民生保障要就业优先、兜牢底线，多渠道挖掘就业潜力，加大培训补贴力度，加强灵活弹性用工，千方百计、综合施策，吸引和留住各类人才。
根据气象部门预测，今年汛期本市将呈现降水总量略多，梅雨量正常，影响台风多，高温日数正常至略多的特点。会议指出，防汛防台事关城市运行安全大局，容不得丝毫麻痹大意和侥幸心理。各区、各部门要切实强化风险意识，提早谋划部署，积极做好应对处置预案方案，牢牢守住防汛防台安全的底线和红线。要加强监测预报预警，深化隐患排查整改，提高防汛应对水平。
会议还研究了其他事项。
",类主体; 疫情防控; 投资者; 消费者信心;,
365,网点节点应开尽开，保供人员应返尽返,侍佳妮;,2,5/16/22,3,https://kns.cnki.net/kcms2/article/abstract?v=XvFfKg0MvvX1b2fDUaIYIN3oyrsdP4w83vZX_4zDw-CLMBENOQ6S8b2zW4MOQB4qTUCiux5GBeNJoC--ngiXcbSkKrqLQDvNAvAuNzQzQsqNqzb9p28nxgt8OB9M7I0k&uniplatform=NZKPT,"购物中心、百货商场、超市卖场、便利店、药店等商业网点逐步有序恢复线下营业，划定进出通道，做好人员限流，并推行“线上订、线下送”和“线下到店消费”服务
农贸市场逐步有序恢复，批发市场开展无接触交易，暂停零售业务，合理控制在场人数和入场采购人数，严格落实来场车辆和司乘人员防疫措施。菜市场开展集中采购，有序恢复线下营业，合理控制开摊率和客流量
餐饮、理发和洗染服务逐步有序恢复，餐饮服务实行线上、线下外卖，理发、洗染服务实行错峰限流
本报讯（记者 侍佳妮）记者从昨天举行的市新冠肺炎疫情防控新闻发布会上获悉，从5月16日起，按照“有序放开、有限流动、有效管控、分类管理”原则，严格落实各项疫情防控措施，上海将分阶段推进复商复市。
副市长陈通介绍，为做好群众基本生活保障和生活物资供应，上海确定“保基本、全覆盖”工作目标，大力推动网点节点应开尽开、保供人员应返尽返，全市运营商业网点从最低谷的不到1400个，增加到10625个，日配送订单达到500万份。
购物中心、百货商场、超市卖场、便利店、药店等商业网点逐步有序恢复线下营业，划定进出通道，做好人员限流，并推行“线上订、线下送”和“线下到店消费”服务。农贸市场逐步有序恢复，批发市场开展无接触交易，暂停零售业务，合理控制在场人数和入场采购人数，严格落实来场车辆和司乘人员防疫措施。菜市场开展集中采购，有序恢复线下营业，合理控制开摊率和客流量。餐饮、理发和洗染服务逐步有序恢复，餐饮服务实行线上、线下外卖，理发、洗染服务实行错峰限流。
截至14日，全市12家重点连锁超市卖场企业，合计门店总数1625家，实开门店数1193家，其中，线下营业门店总数183家，线上营业门店总数1010家。全市15家重点连锁便利店企业，合计门店总数6208家，实开门店数2214家，其中，线下营业门店总数673家，线上营业门店总数1541家。目前，各区和相关企业正在进行线上营业门店恢复线下营业的准备工作。
快递外卖骑手是生活物资保供的重要力量。市商务委、市邮政管理局持续推动将配送寄递企业和人员纳入“白名单”，实施动态管理。5月14日，全市纳入“白名单”的配送寄递人员共11.8万人，其中电商平台、超市卖场、餐饮企业配送人员10.6万人，快递人员1.2万人。
14日，上海新增166例新冠肺炎本土确诊病例和1203例本土无症状感染者。166例本土确诊病例中，55例在闭环隔离管控中发现,111例为无症状感染者转归确诊病例。1203例本土无症状感染者均在闭环隔离管控中发现。14日，全市本土确诊病例出院290例，无症状感染者解除集中隔离医学观察4003例，在定点医疗机构接受治疗的重型患者286例、危重型67例。新增本土死亡病例3例。
",门店总数; 无症状; 感染者; 便利店; 商业网点; 确诊病例; 餐饮服务;,
366,调产能赶进度，做好下游压舱石,查睿;,2,5/16/22,1,https://kns.cnki.net/kcms2/article/abstract?v=XvFfKg0MvvWQzW5MOixp-1YX3sO2n1iY5jfc41VS0Lw3NnEehaY9o33yGrT-jciUWuECyZP8lhWD4DIIR6n8cDApKs-BZLGoPTlGzxyCQv4SbVJ2sUL4b_0F39rSN0Ua&uniplatform=NZKPT,"“终于等来复工的日子，现在抓紧时间，进度说不定还赶得及！”近日，因疫情而部分停工的大丝束碳纤维项目迎来全面复工，上海石化工程部负责人张春峰立马投入紧张的施工作业中。随着全市复工复产脚步逐渐加快，申城化工能源企业开始逐步调整产能，加大返岗力度，确保产业链不断档。
不停产
闭环管理稳供应链
由于炼化行业的特殊性，高桥石化保持24小时连续生产状态。公司副总工程师曹文磊告诉记者，无论是成品油、液化气还是橡胶、ABS合成树脂等生产线，装置安全平稳运行。
“3月初期，受到疫情封控等因素影响，公路运输受阻，产品无法送出，我们曾面临市场供给中断的风险，但在市经信委等主管部门的关心支持下，我们顺利拿到了车辆通行证，及时打通堵点。”曹文磊表示，有一家浙江企业急需工业液化气，高桥石化一拿到通行证就立刻恢复供应，解决了该企业的难题。“我们对下游产业链复工复产起到压舱石的作用，特别是橡胶和ABS合成树脂等，对汽车生产线来说不可或缺。”目前，高桥石化已经做好充分准备，产能调整可以满足下游产业链复工复产的增长所需。
位于上海化工区的华谊新材料有限公司是国内首个丙烯酸及酯智能工厂，从3月中旬开始，全员驻厂封闭管理，员工与承包商近700人全部落实到位。据介绍，目前公司二期装置启动生产，待运行稳定后企业整体产能有望翻倍。
记者从上海化工区了解到，园区共有重点企业60多家，其中47家重点企业一直保持连续生产。截至目前，园区重点企业复产率达91%。
抢进度
增加人员制定赶工计划
上海市重大工程项目上海石化“2.4万吨/年原丝、1.2万吨/年48k大丝束碳纤维”项目，目前迎来全面复工，受疫情影响，第一阶段原计划6月18日机械中交，将争取7月18日中交。
据张春峰介绍，大丝束项目部虽然提前落实防控措施，但受疫情形势影响，部分施工区域不得不陆续停工。“上海市外设备生产运输、进口设备进关等无法及时交货，商品混凝土、焊接保护气、切割气等项目易耗品也几近断供。”
为保证施工力量，上海石化马上腾出培训中心2栋教学楼，硬件措施满足封控条件后，组织员工返岗。截至目前，返岗人员均未出现异常。
张春峰表示，下阶段上海石化将再组织相关单位，对各主项的物资到货、施工等进行对接，并通过增加施工力量、工序无缝衔接、适当延长作业时间等方面制定赶工计划，在确保疫情防控和施工安全环保质量的前提下赶抢进度，将进度滞后的影响降到最低。
保民生
餐饮行业用气量略有抬升
自上海新一轮疫情防控攻坚以来，中国石化炼油销售公司统筹在沪生产企业资源，联合高桥石化、上海石化承担起上海全市民生用气保供任务，连续30天互通产销变动与出厂方案，累计供应上海民用液化气超2万吨，切实保障了崇明区及浦东新区周浦、惠南、康桥等社区卫生服务中心和部分隔离酒店等用气需求。
与大型能源企业相比，上海百斯特能源发展有限公司在岗员工仅500余人，但作为保供类的中型企业，疫情期间同样坚持不停工。总经理李晓影告诉记者，根据疫情需求变化，企业在保供重点上有所侧重，原来民用液化气占比仅为1/3，近两个月来餐饮行业和工业类需求下降，民用占比已高达90%，因此百斯特加大民用保供的产量。他表示，随着复工复产节奏的加快，餐饮行业需求略有抬升，目前液化气吞吐量较4月初增长了10%左右。
防疫情
返岗前仍需静默或隔离
“自3月10日以来，高桥石化厂区就进入了闭环管理状态。”作为高桥石化疫情防控专班负责人，安环部副经理滕武告诉记者，封控期间有2100多名员工坚守岗位，占全员近60%。
为了让更多人返岗工作，高桥石化做足了防疫预案。滕武介绍说，返岗员工从家里出发到单位，一律点对点专车接送，不乘坐公共交通和私家车，专车司机不仅全身防护并做到一车一消毒。此外，高桥石化还在工作区和社会面中间设置了“缓冲区”，并进一步分为红区、黄区和蓝区。红区专门为核酸阳性人员集中隔离，黄区安置密接和次密接人员，蓝区则专为返岗人员准备，所有返岗人员都必须在蓝区隔离3天，并通过多次核酸和抗原才能进入工作区域。
面对一年一度的大检修，上海石化厂区内将迎来2000多名专业检修人员，这一场防疫大考如何应对？上海石化行政事务中心工作人员告诉记者，无论是自有员工还是服务商员工均要求确认入厂前14天的行程及居住地疫情整体情况，落实专车进行点对点转运，并设置7天静默管控期。
完成静默管控进入厂区后，上海石化根据实际检修情况，划定大小区域并落实相对独立的管控，严格控制人员流动范围。
",上海石化; 大丝束; 疫情防控; 液化气; 闭环管理; 合成树脂; 施工力量; 张春峰; 重点企业; 餐饮行业;,
367,凝聚起抗疫生力军的“努努老师”,王海燕;冯笑;,2,5/16/22,1,https://kns.cnki.net/kcms2/article/abstract?v=XvFfKg0MvvWQzW5MOixp-1YX3sO2n1iY5jfc41VS0Lw3NnEehaY9o33yGrT-jciURaDhgv43Im1_xUcl4ypHWfSEAuwenSBjjDtc12_GQac__-6BI-Ua2caDntddRgUf&uniplatform=NZKPT,"哈萨克族的哈丽努·哈力木拉提是复旦大学的一名老师，3月23日，她带了些简单的行李，来到延吉街道内江新村的妹妹家，原计划住三天就返回校园，因为突如其来的封闭管理，她在这个小区待了一个多月。这段特殊的日子里，她以党员志愿者身份站到抗疫第一线。
协助新书记组建“生力军”
3月末，哈丽努积极响应组织号召，第一时间通过“先锋上海”亮明党员身份，并主动联系社区报到。同时，她申请加入内江新村的志愿者团队，开始参与社区配药服务的相关工作。
进入4月，疫情在社区内蔓延，内江新村疫情防控临时党支部书记刘伟雄刚刚到任，哈丽努主动与新书记联系沟通。新书记急需调动各方力量，哈丽努积极配合，迅速召集了一批社区青年组成志愿者团队。
这支内江新村的“生力军”是哈丽努在两天时间内成功组建起来的。她通过线上问卷招募，再一个个电话沟通、一条条微信确认，确保所收集的信息真实可靠，最终交到书记手里的是一份有45人的志愿者名单。他们被分配到门岗值守、快递搬运、巡逻消杀以及配药保障四个小组，哈丽努帮着一起配送快递、发放物资、统计抗原结果。正是这个快速凝聚起来的团队，确保了各项防疫工作重回正轨，阻断了疫情在社区内进一步传播。
上线疫情“小灵通”
在内江新村的这段日子，哈丽努通过和志愿者伙伴联手抗疫，结交了不少新朋友。她的微信朋友新增了70多位小区居民，前后共加入15个群聊，组织了小区第一次团购，带头参与几个志愿者工作小组。很多居民微信向她发来感谢，上了年纪的阿姨爷叔时不时地关心问候……小区居民都称她为“努努老师”。
疫情暴发后，不停增加的阳性病例让居民的恐慌情绪蔓延。为此，内江新村疫情防控临时党支部书记提出每日通报防疫信息。哈丽努自告奋勇承担了这项工作，从4月20日开始，每天编辑“新村小灵通”长图文，定时在新村各微信群内发布。新村内的确诊病例数量、核酸检测结果、楼道消杀安排、物资发放进度、垃圾处理安排等，这些疫情期间居民最关注的事情，每天都会以疫情通报的形式出现在“新村小灵通”头条，及时有效的信息让之前的猜疑、埋怨甚至不满烟消云散。
“新村小灵通”的发布得到新村党总支和居委会全力支持，他们每天把最详实的数据和讯息提供给哈丽努，她逐步将志愿者故事、好人好事的投稿以及楼栋里发生的新鲜事融入“新村小灵通”。于是，新村里各种温暖人心、振奋士气的善行义举被流传开。在疫情笼罩的特殊时期，这份暖意和力量鼓舞着每一个人，也让哈丽努觉得自己正在做一件很有意义的事。
重返校园继续战斗
哈丽努不是内江新村的“原住民”，左邻右舍原本对这姐妹俩都不太熟悉。经过这次疫情，哈丽努却成了楼栋的绝对“主力”。
除了担任小区志愿者，哈丽努还是8号楼在封闭期间开启楼栋自治的带头人。最开始，她协助楼组长阿姨，在楼栋微信群及时发布各种重要的公告信息。很快，她又在楼里张罗起公益团购，集资购买了30瓶84消毒液，作为楼道消杀的公共用品；同时，哈丽努召集楼上楼下十多位年轻小伙伴，分时段、分楼层完成楼道消杀，确保楼内安全健康的居住环境。
4月27日，哈丽努收到了获准返校工作的通知。那一天，哈丽努带着不舍和留恋，在微信上和左邻右舍道别。与此同时，她也在不断收到学生们的欢迎和问候。如今，哈丽努已回归校园继续战斗。
",疫情防控; 小灵通; 临时党支部; 生力军;,
368,全力守护人民群众生命安全身体健康,NA;,1,5/16/22,3,https://kns.cnki.net/kcms2/article/abstract?v=XvFfKg0MvvWQzW5MOixp-1YX3sO2n1iY5jfc41VS0Lw3NnEehaY9o33yGrT-jciUno7jL6WDXG8QRC35vuAVkRHx6gQG7j1CcsTniwMbWgRoQJFkCb2sw-eGx8RxoEXo&uniplatform=NZKPT,"本报讯 市委书记李强昨天在相关医疗机构检查疫情防控和互联网医院建设运行情况时指出，要深入贯彻落实习近平总书记重要讲话和指示批示精神，坚持人民至上、生命至上，坚持“动态清零”总方针不动摇，进一步做大做强互联网医院诊疗功能，创新发展模式，扩大医疗供给，畅通配药流程，方便市民就医，全力守护人民群众生命安全和身体健康，为打赢大上海保卫战提供有力支撑。
本轮疫情发生以来，分布在全市市级医院、区级医院和社会办医疗机构的100余家互联网医院，向市民提供线上预约挂号、线上专科咨询、在线复诊、在线开方、医保线上支付、药品配送到家等便民服务，在分流百姓看病配药需求、缓解医院救治压力同时，有效减少人员集聚，降低交叉感染风险。
李强先后来到上海交通大学医学院附属仁济医院、复旦大学附属眼耳鼻喉科医院，看望慰问持续服务奉献在疫情防控和医疗卫生战线上的一线医务人员，察看疫情防控期间互联网医院所支持提供的相关便民服务，详细了解这段时间以来互联网诊疗服务量以及医疗资源配置、医生在线看诊等情况，对打通药品配送堵点、扩大在线就诊范围和加强技术支撑保障等关心的问题与相关部门及医院负责同志作深入交流，就下一步加快发展互联网医院听取大家的意见建议。
李强指出，互联网医院在服务保障群众就医配药及健康管理监测等方面的作用正在不断显现。要始终坚持以人为本，以人的需求为导向，充分考虑人的体验，加大平台建设力度，推动互联网医院各项功能优化提升，更好惠及各类就医群体。要立足医院实际，发挥专业优势，拓展就诊范围，围绕慢性病、常见病、多发病诊疗康复以及健康管理监测、疫情防护科普等，为市民患者提供更优质、更高效的卫生健康服务。要找准就医堵点痛点，突出业务集成、加快流程再造，重视解决老年人等特殊群体“数字鸿沟”问题，使互联网诊疗服务更人性化、便捷化。针对群众十分关心的药品配送等问题，要在实践探索中创新方式方法，加强与配送平台、医药公司的协作对接，进一步理顺流程、拓展渠道，尽最大努力解决药品配送的“最后一公里”问题。要持续关心爱护一线医务人员，大家不怕疲劳、连续奋战在疫情防控最前沿，以医者仁心、精湛医术全力护佑每一个生命，要落实好各项保障举措、激励政策，加强个人防护，严格院感管理，确保医院运行始终安全有序。
市领导诸葛宇杰参加检查。
",诊疗服务; 生命安全; 身体健康; 药品配送;,
