Number,Title,Author,banHao,Date,Download,Links,Contents,Keywords,Editorial
290,上海民营企业结对社区保供显身手,张骏;,1,6/1/22,1,https://kns.cnki.net/kcms2/article/abstract?v=XvFfKg0MvvXPhbNIHMRaugOeMdcqFlHUK5emYKG8aP1mYTihK_o1z1Cx-OSssxR5-BxcbBDW-kxT5s7Br0HF_TS6zWgvWJZs0xxYMhW0HsI8Haolwc9aqhRI72ydQrw1&uniplatform=NZKPT,"在疫情防控分秒必争的关键时刻，针对解决社区抗疫和保供难题，上海民营企业响应号召，挺身而出。
据不完全统计，上海400多家商协会、5459家民营企业，对口222个乡镇街道和园区、1740个封控村居和2934个封控小区，建立了民营企业突击队724支1.72万人，组织发动志愿者11.08万人，协调解决突出问题2927件，捐款捐物合计6.99亿元，其中捐款1.12亿元，用实际行动形成抗击疫情、共克时艰的强大合力。
迅速释放潜能提升保供能力
抗击疫情是一场物质角力，更是一场精神较量。当城市运行速度慢下来，人民群众的日常生活所需却一刻不能停滞。
4月中旬以来，上海各级工商联、商协会和广大民营企业响应市委号召，积极参与基层社区对口保供，形成了民营企业“分区包干、对口保供”的社区支援服务体系。
叮咚买菜、美团、圆通速递等重点平台企业迅速释放潜能，从全国各地调配数以千计的专业人员，参与商品加工和分选工作，重点解决分拣和运力不足问题，投身稳价保供。好药师、叮当快药等企业则推出“团购送到家”和“药品次日达”服务，解决上百个社区居民购药难问题。
为提高全市物流、电商、商超等大型民企的保供能力，市工商联推出外卖骑手招募、社区药品集采、核酸检测点增设等系列专项行动，并倡议“为身边的‘快递骑士’提供住宿空间”。酒店行业、商业地产、办公楼宇迅速响应，多方协调努力下，先后筹措1600多间房间和7000多平方米商业空间，供骑手、物流人员入住。更有企业家筹措物资，深夜探访“小哥”暂居处所，了解实际困难，为保供人员“保供”。
为特殊群体提供保障
610次驰援、3万余公里的爱心足迹，复星集团依托复星基金会，先后启动“社区驰援”“老吾老”“幼吾幼”三个项目，累计为在沪高校和社区等提供各类物资293.9万件。
拼多多、来伊份等企业推出各类保供套餐，全力保障居民的“菜篮子”“米袋子”。位于松江区的来伊份物流中心，自4月初以来始终灯火通明，24小时不断电、不断岗。
上海安徽商会紧急成立“徽骆驼”物资急助平台为老弱纾困。干细胞集团实施“关爱宝宝抗疫不断粮”计划，解决婴幼儿奶粉供应。耶里夏丽为少数民族群众提供清真食品36947份、物资保障包17424份。
跨前一步啃硬骨头
在疫情防控攻坚阶段，上海广大民营企业积极组织突击力量，深入老旧小区、城中村、建筑工地、养老院等重点场所，以志愿者身份参与拔点清面任务。
“疫情是一场战争，我们坚决不做旁观者。”这是上海浙江商会会长王均金常挂在嘴边的一句话。在均瑶集团统筹部署下，浙江商会秘书处迅速成立疫情防控应急工作组，68家会员企业结对支援北蔡61个村居委，为超过3万户家庭和5个养老院先后送去37批约9.2万箱各类生活基本物资和其他紧缺物资。
硬核技术助力社区抗疫
凭借企业专业优势，不少科技型民营企业在社区抗疫战场上持续发力，一个个便捷小程序，一项项新技术火速上线，为提升疫情防控能效、减轻社区防疫压力提供有力支撑。
上海音锋机器人股份有限公司研发的无人车，在降低居民接触感染风险的同时，减轻了社区志愿者的配送压力。上海西井信息科技公司开发出“井井有序”数智社区小程序，涵盖社区出入证、核酸检测叫号及统计、自定义居民通知、抗原结果AI识别上传及统计等功能，不仅减轻一线防疫人员压力，还可通过合理安排避免人群聚集风险。
4月中旬，由波克科技股份有限公司自主研发的“靠普互助”微信小程序迅速出圈，在这个小程序上，街镇授权部分封控时间较长、人员多而需求供给不足的居委会发布需求，打破属地限制，区商会所属企业可进行需求认领。这款小程序上线试运营第一天，即有近百家民营企业登录平台发起援助。
",民营企业; 疫情防控;,
291,打通物流堵点，政策扶持要明确细则,顾杰;,2,6/1/22,1,https://kns.cnki.net/kcms2/article/abstract?v=XvFfKg0MvvXPhbNIHMRaugOeMdcqFlHUK5emYKG8aP1mYTihK_o1z1Cx-OSssxR5EaaYINvx-7-mu-POPMrHIqixxa40v4ZpgE44CcS4ESAOBurUZ_pJHIxYOPDnf1dB&uniplatform=NZKPT,"“现在我们的客户还是比较着急的。”市政协常委、上海明佳集团总裁赵丽佳告诉记者，其集团旗下经佳文化公司目前运营管理将近130万平方米的产业园区，入驻企业近600家。“企业希望在做好防疫的前提下，尽快开展正常的生产经营活动。”
当前，上海正恢复正常生产秩序。在此过程中，企业还面临哪些亟待解决的堵点问题？该如何解决？记者采访了多位来自企业界的政协委员。
恢复跨省运力
对不少企业来说，物流畅通是开展生产经营的必备前提之一，作为园区运营方负责人，赵丽佳的感受更深刻。前段时间，园区内有一家生产医疗器械的企业，需要外地的上家供货，但由于物流没通，这家企业迟迟拿不到货无法生产，面临违约问题。最后，园区帮忙辗转联系了一家相熟的物流公司，暂时解决了供货问题，但类似原因导致的违约现象，并不在少数。
“目前，上下游产业链供应链的物流渠道还是不够通畅，亟待进一步打通。”疫情期间，市政协委员、上海国金投资有限公司总裁王俊也收到不少企业反馈，跨省运力仍存在堵点，尚待恢复。“市级层面应加强与外省，特别是长三角地区的沟通协调，共同建立保障物流畅通的监督反馈协调机制，保障物资运送通畅。”
增强政策可操作性
随着封控时间延长，停工停产造成的订单因不能按时交货而被取消等问题，令很多企业蒙受损失、资金链紧张。在诸多降低企业经营成本的纾困措施中，减免房屋租金是焦点之一。
今年3月发布的《上海市全力抗疫情助企业促发展的若干政策措施》明确，承租国有房屋从事生产经营活动的小微企业和个体工商户，2022年免除3个月租金，2022年被列为疫情中高风险地区所在的街镇或因落实防疫要求严重影响经营活动的，再免除3个月租金，全年合计免除6个月租金。
如何进一步增强房租减免扶持政策的可操作性？市政协委员、市总商会副会长曹文洁建议，对非国有的各类市场运营主体主动减免承租人部分房租的，明确扶持政策的具体细则。如本次疫情期间主动减免的，除对其按照实际减免金额给予一定比例的财政补贴外，还可允许参照捐赠准予，在计算应纳税所得额时扣除，以激励主动减免的积极性。
在伍爱群等委员看来，助企纾困政策的制定实施应更加注重精准性、直达性、普惠性。企业在获得认定后，无须重复提交申报材料，核对内容无误后，便可享受政策。
有委员认为，随着疫情防控形势变化，企业在疫情期间出现的法律纠纷将在封控措施解除后逐步显现。对此，建议提前编制处理方案，探索解决途径，避免造成短时间内对法院诉讼等司法资源的挤兑。
巢立明等委员建议，在“12348”公共法律服务热线中开辟复工复产法律援助专区，主要负责中小微企业、个体工商户及个人关于疫情和复工复产期间各种法律政策解答及调解申请。与此同时，通过高效处理法律纠纷，尽可能为企业提供纾困救济，挽救受疫情影响的企业。
",政协委员; 经营活动; 政策扶持;,
292,更高效统筹疫情防控和经济社会发展,NA;,1,6/1/22,6,https://kns.cnki.net/kcms2/article/abstract?v=XvFfKg0MvvXPhbNIHMRaugOeMdcqFlHUK5emYKG8aP1mYTihK_o1z1Cx-OSssxR5XrxqCBjLVP3MNE93Yq873aaWCyWbF1eRkmszJS7uCaA20yQLnuDyBtetemvt6Wwa&uniplatform=NZKPT,"要坚决克服侥幸松劲，保持高度警醒警惕，市区两级应急指挥体系要随时保持激活状态，确保第一时间启动响应
层层压实责任、层层传导压力，各区、各街镇、各居村要不折不扣把明确的要求措施执行到位
提高个人防护意识和能力，让打疫苗、做核酸、戴口罩、常洗手、勤扫码、多消毒成为自觉行动
本报讯 连日来，市委、市政府每天晚上召开市新冠肺炎疫情防控工作例会，就做好常态化疫情防控重点工作、加快推动正常生产生活秩序全面恢复进行再部署再压实。市委书记、市疫情防控工作领导小组组长李强在昨晚召开的市疫情防控工作例会上强调，要深入贯彻落实习近平总书记重要讲话和指示批示精神，毫不动摇坚持“动态清零”总方针，按照“疫情要防住、经济要稳住、发展要安全”的要求，加快优化指挥运行体系、完善常态化防控机制，更加高效统筹疫情防控和经济社会发展，奋力夺取大上海保卫战的全面胜利。
市委副书记、市长、市疫情防控工作领导小组组长龚正在会上作工作部署。市人大常委会主任蒋卓庆、市政协主席董云虎、市委副书记诸葛宇杰出席会议。
会议指出，在以习近平同志为核心的党中央坚强领导下，在全国各相关部门、兄弟省区市和人民军队的大力支持下，全市上下团结一心、连续奋战，取得了大上海保卫战的重大阶段性成果。随着疫情防控转入常态化防控阶段，要坚决克服侥幸松劲，保持高度警醒警惕，市区两级应急指挥体系要随时保持激活状态，确保第一时间启动响应，做到统一调度、信息共享、高效指挥。要层层压实责任、层层传导压力，各区、各街镇、各居村要不折不扣把明确的要求措施执行到位。要把重要基础性工作抓得更牢，强化底数排摸到位、信息集成应用，推动全量数据共享、业务流程优化，提高常态化疫情防控的工作效率，推动防控措施形成闭环、应急处置科学高效，更好掌握工作主动。要结合实战实践，全面优化常态化核酸采样点布局和检测能力匹配，持续加强人员培训、质量管理和现场秩序维护，提升效率、确保安全。要强化疫情防控“四方责任”，提高个人防护意识和能力，通过广泛的宣传引导和知识普及，让打疫苗、做核酸、戴口罩、常洗手、勤扫码、多消毒成为自觉行动，推动形成健康生活方式。要以无疫小区、无疫单位、无疫场所创建为抓手，发动群众守护家园，形成责任共同体。
相关市领导出席会议。
",经济社会发展; 常态化; 疫情防控; 戴口罩;,
293,让如常生活回归，让经济恢复重振,孟群舒;,1,6/1/22,2,https://kns.cnki.net/kcms2/article/abstract?v=XvFfKg0MvvXPhbNIHMRaugOeMdcqFlHUK5emYKG8aP1mYTihK_o1z1Cx-OSssxR5euvgXOmhZb1rsqKQyzbuUJA41sWMHhtbdSmF-o9pW_nUBEpcdGs1z5qG3oqwrV3Q&uniplatform=NZKPT,"本报讯（记者 孟群舒）市委副书记、市长龚正昨天来到居民小区、街面、大型商超和办公楼宇，检查恢复生产生活秩序准备情况。龚正指出，要深入贯彻落实习近平总书记重要讲话和指示批示精神，按照市委、市政府部署要求，抓紧抓实抓细疫情防控常态化管理，全面恢复全市正常生产生活秩序，以细致周密的工作和扎实有效的举措，让如常的生活平稳回归，让上海经济恢复重振。
下午，龚正一行来到长宁区上航新村居民区，实地察看无疫小区管理情况，了解居民区开展环境清洁和预防性消杀举措，叮嘱继续把社区作为疫情防控第一线，既要落实好“应放尽放”，又要做好各项日常防疫要求。在徐家汇商圈，市领导详细询问商圈恢复线下营业时间安排，并沿着天钥桥路步行察看。市民们在老字号熟食店外保持间隔、排队选购，更多临街店铺正在做开业准备。世纪联华黄浦新苑店已恢复营业数日，大卖场备足了各色商品，强化员工健康监测和门店清洁消毒工作。龚正走进大卖场察看，要求各类商业网点规范部署场所码、“数字哨兵”，严格落实扫码入场措施，管控好聚集性风险。市领导还来到黄浦区新茂大厦，深入了解办公楼租户复工计划以及大厦常态化疫情防控预案，要求商务楼宇落实各项防控要求，做好应急预案，创建无疫楼宇、打造亿元楼宇，实现疫情防控和经济发展“两手抓”“两手赢”。
龚正指出，上海将从6月1日起进入全面恢复全市正常生产生活秩序阶段，要针对常态化疫情防控新特点，进一步提高防控水平和治理能力。要有效管控疫情反弹风险，健全便捷灵敏的发现机制、及时高效的处突机制、动态调整的管控机制、自觉自律的自我健康管理机制，持续创新方法、优化措施，全力提高疫情应急处置效率。要抓紧完善常态化管理预案，做到组织机制到位、基础工作到位、基层力量到位、应急预案到位。要加强防疫科普教育，倡导市民做好个人防护，自觉遵守防疫规定，共同守护来之不易的疫情防控成果。
副市长刘多参加调研。
",疫情防控; 大卖场;,
